{
  "schema_version": 2,
  "run_id": "synthetic-ten-frame-fixture",
  "mode": "replay",
  "frame_index": 9,
  "timestamp": "2026-10-01T12:00:08Z",
  "frequency_mhz": 106.5,
  "receiver": {
    "name": "Demo Malaxa receiver",
    "latitude": 35.4669583333,
    "longitude": 24.0796027778,
    "altitude_m": 640.0
  },
  "transmitter": {
    "name": "Demo transmitter hypothesis",
    "latitude": 35.5319138889,
    "longitude": 24.0683722222,
    "altitude_m": 111.0
  },
  "localization": {
    "available": false,
    "method": "none",
    "note": "Synthetic radar replay. No geographic target position. Confidence is unavailable; no calibrated score exists."
  },
  "targets": [
    {
      "track_id": 1,
      "status": "coasting",
      "bistatic_range_m": 11800.0,
      "excess_range_m": 4501.893892948973,
      "range_rate_mps": -100.0,
      "doppler_hz": 35.524576138603194,
      "confidence": null,
      "age_frames": 8,
      "misses": 3,
      "position": null
    }
  ],
  "range_doppler_image_url": null
}
