{
  "schema_version": 2,
  "run_id": "synthetic-ten-frame-fixture",
  "mode": "replay",
  "frame_index": 10,
  "timestamp": "2026-10-01T12:00:09Z",
  "frequency_mhz": 106.5,
  "receiver": {
    "name": "Demo Malaxa receiver",
    "latitude": 35.4669583333,
    "longitude": 24.0796027778,
    "altitude_m": 640.0
  },
  "transmitter": {
    "name": "Demo transmitter hypothesis",
    "latitude": 35.5319138889,
    "longitude": 24.0683722222,
    "altitude_m": 111.0
  },
  "localization": {
    "available": false,
    "method": "none",
    "note": "Synthetic radar replay. No geographic target position. Confidence is unavailable; no calibrated score exists."
  },
  "targets": [],
  "range_doppler_image_url": null
}
